"127",127,"World","M",97.63,"M","Town of Taylorsville, North Carolina","Town of Taylorsville, NC, USA","Town of Taylorsville","Locality","City","Town of Taylorsville","Town of Taylorsville, North Carolina"," "," ",19," "," "," "," "," "," "," "," "," "," "," "," "," "," "," "," "," "," "," "," "," "," "," ","Town of Taylorsville"," ","Alexander County","North Carolina","NC"," "," "," "," ","USA","United States","ENG",0,-81.17559,35.91747,-81.17559,35.91747,-81.21059,-81.14059,35.88247,35.95247," ","Taylorsville, Town of",NA,NA,NA,NA,NA,"North Carolina",NA,NA,NA,"Region 4","North Carolina","Taylorsville, Town of","CS370700-05","Loan","Not Applicable","Final Agreement",2016-06-20,1085575,2019-09-18,1035726,0,NA,0,0,20,"Yes",500000,0,"No","No","No",NA,"No",0,0,0,0,0,"Sewer Rehabilitation","2015 Collection System Rehab Project - the rehabilitation of approximately 18,000 lf of gravity sewer, including CCTV and smoke testing a total of 68,000 lf sewer","Centralized Wastewater Treatment - Sewer System Rehabilitation: $1,035,726.00",NA,NA,0,NA,NA,"Meeting Standards","Maintain Compliance","Class C: Secondary<br><br>Water Supply IV (WS-IV): Secondary",NA,"Maintenance","No",NA,c(1355854.65823491, 795914.814261687)
"133",133,"World","M",97.24,"A","City of Hickory, North Carolina","City of Hickory, NC, USA","City of Hickory","Locality","City","City of Hickory","City of Hickory, North Carolina","","",19,"","","","","","","","","","","","","","","","","","","","","","","","City of Hickory","","Catawba County","North Carolina","NC","","","","","USA","United States","ENG",0,-81.32302,35.74255,-81.32302,35.74255,-81.40402,-81.24202,35.66155,35.82355,"","Hickory, City of",NA,NA,NA,NA,NA,"North Carolina",NA,NA,NA,"Region 4","North Carolina","Hickory, City of","CS370389-21","Loan","Not Applicable","Final Agreement",2016-05-09,3519475,2020-08-06,2980352,1.66,0,1.66,0,20,"No",0,0,"No","No","No",NA,"No",0,0,0,0,0,"Geitner Basin Sewer System Rehab","Rehabilitate approximately 4,440 LF of 8-10 inch sewer, replace approximately 690 LF of 8-12 inch sewer line with same size pipe, Replacement or rehabilitation of approximately 57 manholes.","Centralized Wastewater Treatment - Sewer System Rehabilitation: $2,980,352.00",NA,NA,40,2017-02-27,2020-08-06,"Meeting Standards","Maintain Compliance","Class C: Secondary<br><br>Class C: Secondary",NA,"Maintenance","No",NA,c(1310721.70033322, 733250.434163489)
"135",135,"World","M",97.24,"A","City of Hickory, North Carolina","City of Hickory, NC, USA","City of Hickory","Locality","City","City of Hickory","City of Hickory, North Carolina","","",19,"","","","","","","","","","","","","","","","","","","","","","","","City of Hickory","","Catawba County","North Carolina","NC","","","","","USA","United States","ENG",0,-81.32302,35.74255,-81.32302,35.74255,-81.40402,-81.24202,35.66155,35.82355,"","Hickory, City of",NA,NA,NA,NA,NA,"North Carolina",NA,NA,NA,"Region 4","North Carolina","Hickory, City of","CS370389-20","Loan","Not Applicable","Final Agreement",2016-05-09,1364100,2020-03-02,1364100,1.66,NA,1.66,0,20,"No",0,0,"No","No","No",NA,"No",0,0,0,0,0,"Central Business District (CBD) Infrastructure Renewal Project","Replace 1,500 LF of 6-inch clay pipe with 8-inch sewer, Replace/Rehab approximately  2,700 LF of 8-12 inch sewer and construction/repair of 43 manholes.","Centralized Wastewater Treatment - Sewer System Rehabilitation: $1,364,100.00",NA,NA,0,2017-02-06,2017-12-04,"Meeting Standards","Maintain Compliance","Class C: Secondary",NA,"Maintenance","No",NA,c(1310721.70033322, 733250.434163489)
"140",140,"World","M",98.75,"A","Granite Falls Town Office","Granite Falls Town Office, 30 Park Ave, Granite Falls, NC, 28630, USA","Granite Falls Town Office","POI","Government Office","Granite Falls Town Office","30 Park Ave, Granite Falls, North Carolina, 28630","(828) 396-3131","www.granitefallsnc.com",22,"","30","","","","","","","Park","Ave","","","","","","","","","30 Park Ave","","","","","Granite Falls","","Caldwell County","North Carolina","NC","","","28630","","USA","United States","ENG",0,-81.428563981211,35.77849892164,-81.4285701,35.7784089,-81.4335701,-81.4235701,35.7734089,35.7834089,"","Granite Falls, Town of",NA,NA,NA,NA,NA,"North Carolina",NA,NA,NA,"Region 4","North Carolina","Granite Falls, Town of","CS370372-03","Loan","Not Applicable","Amendment",2015-11-16,600000,2018-08-10,508880,1.83,NA,1.83,0,20,"No",0,0,"No","No","No",NA,"No",0,0,0,0,0,"Installation of an additional 250,000 gallon sludge storage tank","Installation of an additional 250,000 gallon sludge storage tank","Centralized Wastewater Treatment - Secondary Treatment: $508,880.00",NA,"NC0082546",0,2017-03-01,2017-09-01,"Meeting Standards","Maintain Compliance",NA,NA,"Maintenance","No",NA,c(1279728.64312306, 747048.388521384)
"141",141,"World","M",98.75,"A","Granite Falls Town Office","Granite Falls Town Office, 30 Park Ave, Granite Falls, NC, 28630, USA","Granite Falls Town Office","POI","Government Office","Granite Falls Town Office","30 Park Ave, Granite Falls, North Carolina, 28630","(828) 396-3131","www.granitefallsnc.com",22,"","30","","","","","","","Park","Ave","","","","","","","","","30 Park Ave","","","","","Granite Falls","","Caldwell County","North Carolina","NC","","","28630","","USA","United States","ENG",0,-81.428563981211,35.77849892164,-81.4285701,35.7784089,-81.4335701,-81.4235701,35.7734089,35.7834089,"","Granite Falls, Town of",NA,NA,NA,NA,NA,"North Carolina",NA,NA,NA,"Region 4","North Carolina","Granite Falls, Town of","CS370372-02","Loan","Not Applicable","Initial Agreement",2015-11-16,1900000,2015-11-16,1900000,1.83,NA,1.83,0,20,"No",0,0,"No","No","No",NA,"No",0,0,0,0,0,"Replacement of existing arc screen and grit air lift pump: construction of 20,000 lf of force main","Replacement of existing arc screen and grit air lift pump: construction of 20,000 lf of force main to the Albemarle WWTP","Centralized Wastewater Treatment - Secondary Treatment: $1,900,000.00",NA,"NC0021890",0,2016-07-07,2017-06-20,"Meeting Standards","Maintain Compliance",NA,NA,"Maintenance","No",NA,c(1279728.64312306, 747048.388521384)
"142",142,"World","M",98.75,"A","Granite Falls Town Office","Granite Falls Town Office, 30 Park Ave, Granite Falls, NC, 28630, USA","Granite Falls Town Office","POI","Government Office","Granite Falls Town Office","30 Park Ave, Granite Falls, North Carolina, 28630","(828) 396-3131","www.granitefallsnc.com",22,"","30","","","","","","","Park","Ave","","","","","","","","","30 Park Ave","","","","","Granite Falls","","Caldwell County","North Carolina","NC","","","28630","","USA","United States","ENG",0,-81.428563981211,35.77849892164,-81.4285701,35.7784089,-81.4335701,-81.4235701,35.7734089,35.7834089,"","Granite Falls, Town of",NA,NA,NA,NA,NA,"North Carolina",NA,NA,NA,"Region 4","North Carolina","Granite Falls, Town of","CS370372-01","Loan","Not Applicable","Initial Agreement",2015-11-16,610000,2015-11-16,610000,1.83,NA,1.83,0,20,"No",0,0,"No","No","No",NA,"No",0,0,0,0,0,"Replacement of two 45 year old wastewater pump stations","Replacement of two 45 year old wastewater pump stations","Centralized Wastewater Treatment - Sewer System Rehabilitation: $610,000.00",NA,NA,0,2016-07-07,2017-01-16,NA,NA,NA,NA,NA,"No",NA,c(1279728.64312306, 747048.388521384)
"158",158,"World","M",95.71,"A","Town of Stanley, North Carolina","Town of Stanley, NC, USA","Town of Stanley","Locality","City","Town of Stanley","Town of Stanley, North Carolina","","",19,"","","","","","","","","","","","","","","","","","","","","","","","Town of Stanley","","Gaston County","North Carolina","NC","","","","","USA","United States","ENG",0,-81.0937,35.3552,-81.0937,35.3552,-81.1217,-81.0657,35.3272,35.3832,"","Stanley, Town of",NA,NA,NA,NA,NA,"North Carolina",NA,NA,NA,"Region 4","North Carolina","Stanley, Town of","CS370746-02","Loan","Not Applicable","Final Agreement",2015-07-15,2754220,2018-07-20,3029642,1.92,NA,1.92,0,20,"No",0,0,"No","No","No",NA,"No",0,0,0,0,0,"Stanley Sewer Interconnect, Phase II","Stanley Sewer Interconnect, Phase II to Gastonia.","Centralized Wastewater Treatment - Sewer System Rehabilitation: $3,029,642.00",NA,"NC0020184",0,2016-11-14,2018-04-25,"Meeting Standards","Maintain Compliance","Water Supply IV (WS-IV): Secondary",NA,"Improvement","No",NA,c(1375780.82233656, 590784.383920205)
"162",162,"World","M",98.01,"A","City of Charlotte, North Carolina","City of Charlotte, NC, USA","City of Charlotte","Locality","City","City of Charlotte","City of Charlotte, North Carolina","","",19,"","","","","","","","","","","","","","","","","","","","","","","","City of Charlotte","","Mecklenburg County","North Carolina","NC","","","","","USA","United States","ENG",0,-80.83082,35.20797,-80.83082,35.20797,-81.08082,-80.58082,34.95797,35.45797,"","Charlotte, City of",NA,NA,NA,NA,NA,"North Carolina",NA,NA,NA,"Region 4","North Carolina","Charlotte, City of","CS370377-13","Loan","Not Applicable","Amendment",2015-05-11,3266736,2017-08-03,4527301,0,NA,0,0,20,"No",0,3266736,"No","No","No",NA,"No",0,0,0,0,0,"McAlpine Creek WWTP Combined Heat and Power Project","McAlpine Creek WWTP Combined Heat and Power Project - Construction of combined Heat and Power generation (1MW and 7,884,000 kWh per year)","Centralized Wastewater Treatment - Advanced Treatment: $4,527,301.00","McAlpine Creek WWTP ","NCG110010",0,2016-04-11,2017-03-20,"Impaired","Not Applicable",NA,NA,"Maintenance","No",NA,c(1453158.59041887, 535660.143745806)
"163",163,"World","M",95.71,"A","City of Belmont, North Carolina","City of Belmont, NC, USA","City of Belmont","Locality","City","City of Belmont","City of Belmont, North Carolina","","",19,"","","","","","","","","","","","","","","","","","","","","","","","City of Belmont","","Gaston County","North Carolina","NC","","","","","USA","United States","ENG",0,-81.03852,35.23088,-81.03852,35.23088,-81.08752,-80.98952,35.18188,35.27988,"","Belmont, City of",NA,NA,NA,NA,NA,"North Carolina",NA,NA,NA,"Region 4","North Carolina","Belmont, City of","CS370702-06","Loan","Not Applicable","Initial Agreement",2015-03-09,2206490,2015-03-09,2206490,2.21,NA,2.21,0,20,"No",0,0,"No","No","No",NA,"No",0,0,0,0,0,"Sewer Replacement Project","Replacement of 5,000 lf of 8-inch sewer main; replacement of 1,700 lf of 6-inch gravity sewer; rehabilitation of 3,300 lf of gravity sewer","Centralized Wastewater Treatment - Sewer System Rehabilitation: $2,206,490.00",NA,NA,0,2016-05-23,NA,"Not Assessed","Maintain Compliance",NA,NA,"Maintenance","No",NA,c(1391300.8674198, 545205.383630265)
"166",166,"World","M",95.71,"A","Town of Valdese","Town of Valdese, 400 W Main St, Valdese, NC, 28690, USA","Town of Valdese","POI","Performing Arts","Town of Valdese","400 W Main St, Valdese, North Carolina, 28690","(828) 879-2129","www.visitvaldese.com",17,"","400","","","","","W","","Main","St","","","","","","","","","400 W Main St","","","","","Valdese","","Burke County","North Carolina","NC","","","28690","2728","USA","United States","ENG",0,-81.566767537336,35.744193536268,-81.566833,35.744705,-81.571833,-81.561833,35.739705,35.749705,"","Valdese, Town of",NA,NA,NA,NA,NA,"North Carolina",NA,NA,NA,"Region 4","North Carolina","Valdese, Town of","CS370396-08","Loan","Not Applicable","Final Agreement",2014-10-14,285917,2016-12-08,230913,0,0,0,0,20,"No",0,0,"No","No","No",NA,"No",0,0,0,0,0,"I/I project","I/I project","Centralized Wastewater Treatment - Infiltration/Inflow Correction: $230,913.00",NA,NA,4477,2016-02-02,2016-08-10,"Meeting Standards","Maintain Compliance","Water Supply IV (WS-IV): Secondary<br><br>Water Supply IV (WS-IV): Secondary",NA,"Maintenance","No",NA,c(1238414.0043469, 735816.296537841)
"175",175,"World","M",97.63,"A","City of Bessemer City, North Carolina","City of Bessemer City, NC, USA","City of Bessemer City","Locality","City","City of Bessemer City","City of Bessemer City, North Carolina","","",19,"","","","","","","","","","","","","","","","","","","","","","","","City of Bessemer City","","Gaston County","North Carolina","NC","","","","","USA","United States","ENG",0,-81.28414,35.28467,-81.28414,35.28467,-81.31314,-81.25514,35.25567,35.31367,"","Bessemer City, City of",NA,NA,NA,NA,NA,"North Carolina",NA,NA,NA,"Region 4","North Carolina","Bessemer City, City of","CS370763-02","Loan","Not Applicable","Final Agreement",2014-04-02,1565000,2017-11-02,2309529,0,NA,0,0,20,"Yes",782500,0,"No","No","No",NA,"No",0,0,0,0,0,"Sewer System Improvements","The replacement of approximately 8,000 lf of 8-in gravity sewer mains and backup generators at 8 pump stations.","Centralized Wastewater Treatment - Infiltration/Inflow Correction: $2,309,529.00",NA,NA,0,2016-01-11,2017-11-26,"Meeting Standards","Maintain Compliance",NA,NA,"Maintenance","No",NA,c(1318421.74394528, 566373.691668621)
"182",182,"World","M",95.61,"A","City of Lenoir, North Carolina","City of Lenoir, NC, USA","City of Lenoir","Locality","City","City of Lenoir","City of Lenoir, North Carolina","","",19,"","","","","","","","","","","","","","","","","","","","","","","","City of Lenoir","","Caldwell County","North Carolina","NC","","","","","USA","United States","ENG",0,-81.52701,35.90574,-81.52701,35.90574,-81.60801,-81.44601,35.82474,35.98674,"","Lenoir, City of",NA,NA,NA,NA,NA,"North Carolina",NA,NA,NA,"Region 4","North Carolina","Lenoir, City of","CS370393-06","Loan","Not Applicable","Final Agreement",2013-12-05,1275000,2018-06-14,1541984,0,NA,0,0,20,"No",0,0,"No","No","No",NA,"No",0,0,0,0,0,"Meadowood Sewer Replacement","The complete replacementj of approximately 8,000 linear feet of 12-in gravity main.","Centralized Wastewater Treatment - Sewer System Rehabilitation: $1,541,984.00",NA,NA,0,2015-08-24,2016-06-22,"Impaired","Achieve Compliance",NA,"Class C: Secondary<br><br>Water Supply IV (WS-IV): Secondary","Maintenance","No",NA,c(1251718.99636254, 794110.786917451)
"207",207,"World","M",96.8,"A","Drexel Township, North Carolina","Drexel Township, NC, USA","Drexel Township","Locality","City","Drexel Township","Township of Drexel, North Carolina","","",21,"","","","","","","","","","","","","","","","","","","","","","","","Township of Drexel","","Burke County","North Carolina","NC","","","","","USA","United States","ENG",0,-81.60039,35.75527,-81.60039,35.75527,-81.64039,-81.56039,35.71527,35.79527,"OF","Drexel, Town of",NA,NA,NA,NA,NA,"North Carolina",NA,NA,NA,"Region 4","North Carolina","Drexel, Town of","CS370677-01","Loan","Not Applicable","Final Agreement",2013-06-11,471086,2015-09-29,471086,0,NA,0,0,20,"No",0,0,"No","No","No",NA,"No",0,0,0,0,0,"Sewer Pump Station Replacement Project","(1) constructing a new approximately 735 gallon per minute (gpm) submersible duplex pump station adjacent to the existing 700 gpm pump station, (2) extending approximately 100 linear feet of piping to reconfigure the flow to the new pump station, (3) adding a new backup generator, electrical controls and related appurtenances to make the new pump station operational and (4) abandoning the existing pump station. ","Centralized Wastewater Treatment - Sewer System Rehabilitation: $471,086.00",NA,NA,0,2014-08-11,2015-06-26,"Meeting Standards",NA,NA,NA,NA,"No",NA,c(1228560.54144118, 739919.660028415)
"210",210,"World","M",95.61,"A","City of Lenoir, North Carolina","City of Lenoir, NC, USA","City of Lenoir","Locality","City","City of Lenoir","City of Lenoir, North Carolina","","",19,"","","","","","","","","","","","","","","","","","","","","","","","City of Lenoir","","Caldwell County","North Carolina","NC","","","","","USA","United States","ENG",0,-81.52701,35.90574,-81.52701,35.90574,-81.60801,-81.44601,35.82474,35.98674,"","Lenoir, City of",NA,NA,NA,NA,NA,"North Carolina",NA,NA,NA,"Region 4","North Carolina","Lenoir, City of","CS370393-05","Loan","Not Applicable","Final Agreement",2013-05-13,578500,2015-09-14,578500,0,NA,0,0,20,"Yes",289250,0,"No","No","No",NA,"No",0,0,0,0,0,"Powell Road Greenway Sewer Replacement","Replacement of approximatley 5,320 linear feet of 12-in sanitary sewer near Zack' Fork a tributary of Lower Creek","Centralized Wastewater Treatment - Sewer System Rehabilitation: $578,500.00",NA,NA,0,2014-10-06,2015-05-26,NA,NA,"Class C: Primary",NA,NA,"No",NA,c(1251718.99636254, 794110.786917451)
"213",213,"World","M",95.61,"A","City of Lenoir, North Carolina","City of Lenoir, NC, USA","City of Lenoir","Locality","City","City of Lenoir","City of Lenoir, North Carolina","","",19,"","","","","","","","","","","","","","","","","","","","","","","","City of Lenoir","","Caldwell County","North Carolina","NC","","","","","USA","United States","ENG",0,-81.52701,35.90574,-81.52701,35.90574,-81.60801,-81.44601,35.82474,35.98674,"","Lenoir, City of",NA,NA,NA,NA,NA,"North Carolina",NA,NA,NA,"Region 4","North Carolina","Lenoir, City of","CS370393-04","Loan","Not Applicable","Final Agreement",2013-04-09,4170000,2016-10-27,4093662,0,NA,0,0,20,"No",0,0,"No","No","No",NA,"No",0,0,0,0,0,"Gunpowder Creek WWTP Improvements","The proposed project includes: (1) a new 900,000-gallon sequencing batch reactor (SBR); (2) replacement of diffusers and equipment; (3) blower line repairs; (4) SCADA, instrumentation, controls, and other electrical equipment; and (5) piping and valves improvements.","Centralized Wastewater Treatment - Secondary Treatment: $4,093,662.00",NA,"NC0023736",0,2014-07-28,2016-04-18,"Impaired","Achieve Compliance","Water Supply IV (WS-IV): Primary",NA,"Improvement","No",NA,c(1251718.99636254, 794110.786917451)
"234",234,"World","M",96.86,"A","City of Newton, North Carolina","City of Newton, NC, USA","City of Newton","Locality","City","City of Newton","City of Newton, North Carolina","","",19,"","","","","","","","","","","","","","","","","","","","","","","","City of Newton","","Catawba County","North Carolina","NC","","","","","USA","United States","ENG",0,-81.23328,35.66308,-81.23328,35.66308,-81.29228,-81.17428,35.60408,35.72208,"","Newton, City of",NA,NA,NA,NA,NA,"North Carolina",NA,NA,NA,"Region 4","North Carolina","Newton, City of","CS370685-02","Loan","Not Applicable","Final Agreement",2013-01-16,1399000,2015-03-04,1097409,NA,NA,0,0,20,"No",0,0,"No","No","No",NA,"No",0,0,0,0,0,"Snow Creek Sewer Outfall Rehabilitation","Replacement of approximately 7,500 LF of 12-inch diameter gravity sewer, 740 LF of 8-inch gravity sewer, rehabilitation of approximately 1,555 LF of 12-inch gravity sewer using cured-in-place (CIPP) liner and replacement and rehabilitation of associated manholes.","Centralized Wastewater Treatment - Sewer System Rehabilitation: $1,097,409.00",NA,NA,0,2014-02-17,2014-11-04,"Meeting Standards","Maintain Compliance","Class C: Secondary",NA,"Maintenance","No",NA,c(1336693.76362097, 703720.805458746)
"247",247,"World","M",97.63,"M","Town of Taylorsville, North Carolina","Town of Taylorsville, NC, USA","Town of Taylorsville","Locality","City","Town of Taylorsville","Town of Taylorsville, North Carolina"," "," ",19," "," "," "," "," "," "," "," "," "," "," "," "," "," "," "," "," "," "," "," "," "," "," ","Town of Taylorsville"," ","Alexander County","North Carolina","NC"," "," "," "," ","USA","United States","ENG",0,-81.17559,35.91747,-81.17559,35.91747,-81.21059,-81.14059,35.88247,35.95247," ","Taylorsville, Town of",NA,NA,NA,NA,NA,"North Carolina",NA,NA,NA,"Region 4","North Carolina","Taylorsville, Town of","CS370700-04","Loan","Not Applicable","Amendment",2012-11-15,1972821,2016-07-29,1700711,0,NA,0,0,20,"Yes",850355,0,"No","No","No",NA,"No",0,0,0,0,0,"Sanitary Sewer Collection System Extension to serve Millersville Community","Construction of approximately 16,898 if of 8-inch gravity sewer; a 313 GPM duplex pump station (Hines Farm Road PS# 1) with on-site audible and visual high-water alarms, backup generator, telemetry, and approximately 15,518 lf of 8-inch force main; approximately 615 lf of 8-inch gravity sewer; a 52 GPM duplex grinder pump station (Mt. Pilot MHP PS#2) with on-site audible and visual high-water alarms, backup generator, telemetry, and approximately 813 lf of
3-inch force main; approximately 7471f of 8-inch gravity sewer; a 55 GPM duplex grinder pump station (Isenhour Park Road PS#3) with on-site audible and visual high-water alarms, backup generator, telemetry, and approximately 910 lf of 3-inch force main; approximately 5001f of 2-inch water line to serve the Hines Farm Road pump station site; removal and replacement of pavement, roadways, driveways and curbs, sedimentation and erosion control devices, and associated appurtenances necessary for the installation of a complete system within and up to the existing right-of-way, in order to provide sanitary to sewer to an area where there are 62 reported failing septic systems","Centralized Wastewater Treatment - New Collector Sewers: $1,700,711.00",NA,"NC0026271",381,2014-04-14,2016-04-14,"Meeting Standards","Maintain Compliance","Water Supply IV (WS-IV): Secondary",NA,"Improvement","No",NA,c(1355854.65823491, 795914.814261687)
"271",271,"World","M",100,"M","Kershaw County, South Carolina","Kershaw County, SC, USA","Kershaw County","Locality","County","Kershaw County","South Carolina"," "," ",10," "," "," "," "," "," "," "," "," "," "," "," "," "," "," "," "," "," "," "," "," "," "," "," "," ","Kershaw County","South Carolina","SC"," "," "," "," ","USA","United States","ENG",0,-80.590273665002,34.338720297808,-80.590273665002,34.338720297808,-80.875273665002,-80.305273665002,34.053720297808,34.623720297808," ","Kershaw County",NA,NA,NA,NA,NA,"South Carolina",NA,NA,NA,"Region 4","South Carolina","Kershaw County","X1-238-20-587-07","Loan","Not Applicable","Initial Agreement",2023-01-27,2703740,2023-01-27,2703740,1.6,0,1.6,9463,12,"No",0,0,"No","No","No",NA,"No",0,0,0,0,0,"Southern Loop Sewer Improvement - Phase 1","Installation of approximately 21,380 linear feet of l2-inch force main along Fort Jackson Road. Upgrading the Doby's Mill Pump Station, increasing the capacity to 1,080 gallons per minute at 196-inches total dynamic head and all necessary appurtenances.","Centralized Wastewater Treatment - New Collector Sewers: $1,351,870.00<br> Centralized Wastewater Treatment - New Interceptors: $1,351,870.00","KERSHAW CO LUGOFF WWTF","SC0039870",4104,2021-01-25,NA,"Impaired","Maintain Compliance","Freshwaters (FW): Primary",NA,"Improvement","No",NA,c(1519932.35861557, 218113.48054427)
"289",289,"World","M",100,"A","City of Rock Hill, South Carolina","City of Rock Hill, SC, USA","City of Rock Hill","Locality","City","City of Rock Hill","City of Rock Hill, South Carolina","","",19,"","","","","","","","","","","","","","","","","","","","","","","","City of Rock Hill","","York County","South Carolina","SC","","","","","USA","United States","ENG",0,-81.02617,34.94079,-81.02617,34.94079,-81.11317,-80.93917,34.85379,35.02779,"","City of Rock Hill",NA,NA,NA,NA,NA,"South Carolina",NA,NA,NA,"Region 4","South Carolina","City of Rock Hill","X1-249-22-393-34","Loan","Not Applicable","Initial Agreement",2022-06-07,12787411,2022-06-07,12787411,1.81,0,1.81,44756,30,"No",0,0,"No","No","No",NA,"No",0,0,0,0,0,"City of Rock Hill - Tech Park SS Outfall","Tech Park Sanitary Sewer Outfall Replacement.  Replacement of aging city gravity sewer lines that are prone to infiltration and inflow.","Centralized Wastewater Treatment - Sewer System Rehabilitation: $12,787,411.00",NA,NA,84000,2022-11-01,NA,"Meeting Standards","Maintain Compliance","Freshwaters (FW): Primary",NA,"Maintenance","No",NA,c(1392833.34268746, 439577.035916616)
"323",323,"World","M",100,"A","City of Rock Hill, South Carolina","City of Rock Hill, SC, USA","City of Rock Hill","Locality","City","City of Rock Hill","City of Rock Hill, South Carolina","","",19,"","","","","","","","","","","","","","","","","","","","","","","","City of Rock Hill","","York County","South Carolina","SC","","","","","USA","United States","ENG",0,-81.02617,34.94079,-81.02617,34.94079,-81.11317,-80.93917,34.85379,35.02779,"","City of Rock Hill",NA,NA,NA,NA,NA,"South Carolina",NA,NA,NA,"Region 4","South Carolina","City of Rock Hill","X1-221-19-393-29","Loan","Not Applicable","Initial Agreement",2020-06-25,4848432,2020-06-25,4848432,2.6,0,2.6,0,30,"No",0,0,"No","No","No",NA,"No",0,0,0,0,0,"New Project",NA,NA,NA,NA,0,2020-08-03,NA,NA,NA,NA,NA,NA,"No",NA,c(1392833.34268746, 439577.035916616)
"324",324,"World","M",100,"A","City of Rock Hill, South Carolina","City of Rock Hill, SC, USA","City of Rock Hill","Locality","City","City of Rock Hill","City of Rock Hill, South Carolina","","",19,"","","","","","","","","","","","","","","","","","","","","","","","City of Rock Hill","","York County","South Carolina","SC","","","","","USA","United States","ENG",0,-81.02617,34.94079,-81.02617,34.94079,-81.11317,-80.93917,34.85379,35.02779,"","City of Rock Hill",NA,NA,NA,NA,NA,"South Carolina",NA,NA,NA,"Region 4","South Carolina","City of Rock Hill","1-224-19-393-33","Loan","Not Applicable","Initial Agreement",2020-06-25,55300000,2020-06-25,55300000,2.8,0,2.8,193550,30,"No",0,0,"No","No","No",NA,"No",0,4548315,0,0,4548315,"Manchester Creek WWTP Upgrades & Expansion - Headworks Replacement","Improvements to the WWTP include construction of: A new 20 MGD average/60 MGD peak flow influent pump station with two new coarse screens, three new fine screens and three grit removal systems, new odor control, electrical upgrades, a new 8.3 MG equalization basin, a new hauled waste facility and necessary appurtenances.","Centralized Wastewater Treatment - Sewer System Rehabilitation: $55,300,000.00","ROCK HILL/MANCHESTER CREEK","SC0020443",65000,2020-05-20,2023-10-11,"Meeting Standards","Maintain Compliance","Freshwaters (FW): Primary","Freshwaters (FW): Secondary","Improvement","No",NA,c(1392833.34268746, 439577.035916616)
